ai_predicted_category,ai_detected_theme,ticket_count,affected_accounts,avg_severity_score,avg_csat,avg_resolution_time_hours,escalated_rate,churn_risk_rate,refund_rate,arr_exposure,top_affected_segment,primary_region,unique_account_arr_exposure,linked_feature_requests,request_votes,frequency_score,severity_score,csat_impact_score,arr_exposure_score,churn_score,request_pressure_score,priority_score,recommended_action,recommendation
performance,dashboard_latency,221,149,68.47511312217195,2.4847058823529413,32.21158371040724,0.37104072398190047,0.19457013574660634,0.1085972850678733,28874000,SMB,North America,18800000,0.0,0.0,33.71,97.79,62.88,100.0,19.46,0.0,61.26,Stabilize analytics query performance and add proactive status messaging.,Performance / dashboard latency: Stabilize analytics query performance and add proactive status messaging.
billing,invoice_confusion,632,225,43.484177215189874,3.271645569620253,8.88251582278481,0.11234177215189874,0.19778481012658228,0.2389240506329114,32792000,SMB,North America,16194000,0.0,0.0,100.0,25.58,43.21,85.67,19.78,0.0,56.2,Simplify invoice line items and add self-serve billing explanations.,Billing / invoice confusion: Simplify invoice line items and add self-serve billing explanations.
performance,api_timeout,199,144,66.22110552763819,2.5216080402010053,30.762462311557787,0.36180904522613067,0.18592964824120603,0.10552763819095477,23292000,SMB,North America,15970000,0.0,0.0,30.16,91.28,61.96,84.44,18.59,0.0,55.58,"Review ticket samples, validate root cause with support ops, and define owner + SLA.","Performance / api timeout: Review ticket samples, validate root cause with support ops, and define owner + SLA."
bug,notification_bug,242,170,63.06611570247934,2.771322314049587,24.860537190082646,0.30165289256198347,0.12396694214876033,0.10743801652892562,23732000,SMB,North America,16976000,0.0,0.0,37.1,82.16,55.72,89.97,12.4,0.0,54.63,"Review ticket samples, validate root cause with support ops, and define owner + SLA.","Bug / notification bug: Review ticket samples, validate root cause with support ops, and define owner + SLA."
bug,data_sync_bug,226,158,64.87610619469027,2.7849999999999997,24.84561946902655,0.3407079646017699,0.08849557522123894,0.09734513274336283,24192000,SMB,North America,16870000,0.0,0.0,34.52,87.39,55.38,89.39,8.85,0.0,54.29,"Review ticket samples, validate root cause with support ops, and define owner + SLA.","Bug / data sync bug: Review ticket samples, validate root cause with support ops, and define owner + SLA."
